{
  "label": "ASTER-01 margin policy PROPOSAL (synthetic) — contingency and margin values copied from the library example policy; NOT from ECSS or NASA; pending sign-off by the decision owner",
  "is_example": true,
  "policy_id": "ASTER-POLICY-001-DRAFT",
  "margin_basis": "allocation",
  "contingency_percent": {"estimated": 20, "calculated": 10, "heritage": 5, "measured": 3},
  "required_system_margin_percent": 15,
  "budgets": {
    "mass": {"unit": "kg", "allocation": 12.0, "required_system_margin_percent": 15},
    "power": {"unit": "W", "allocation_by_mode": {"safe": 8.0, "arm": 35.0, "trial": 20.0}, "required_system_margin_percent": 15}
  }
}
